Product Name (Temu),Product Price (Temu)
151/53/46/12pcs Wrench Socket Set Hardware Car Boat Motorcycle Repairing Kit Ratchet Spanner Tool Set,8.98
"Ultrasonic Electric Toothbrush, Rechargeable USB, Waterproof Sonic Automatic Tooth Brush For Adults, Whitening Oral Hygiene With 6 Modes 8 Replacement Brush Heads, Extra Soft Toothbrush For Sensitive Gums And Teeth",2.98
"1 Set, Multifunctional Rotating Mop And Bucket Set, Hand-free Cleaning Mop, Hand-press Double-drive Rotation Mop Bucket, Household Round Rotating Floor Mop, For Kitchen, Living Room, Bathroom Cleaning, Cleaning Supplies, Cleaning Tool, Back To School",6.69
"New Men's Fashion Casual Windbreaker Bomber Jacket, Spring Outdoor Waterproof Sports Jacket",23.55
"Star Projector,Galaxy Projector,Ocean Wave Projector, Water Light Projector For Bedroom Night Light Projector,Water Lamp For Adults Gaming Room, Home Theater, Ceiling, Room Decor, Christmas Gift, Valentine's Day Gift Camping Wedding Decor Halloween Christmas Decor, With 7-Color Patterns & Remote Control,USb Powered",4.96
4/8 Pcs 5-Layer Facial Care Shaver Cassettes With Razor Blades For Men - Enjoy Smooth And Close Shaves,2.47
"Men's Dry Fit 2-in-1 Shorts, Active Slightly Stretch Breathable Two Layers Drawstring Shorts For Yoga Running Workout Summer Outdoor",8.55
Retro Style Women's Earrings 42 Pairs 1 Sets 6 Pairs 1 Sets Multi-color Multi-Style Turquoise Embellished Geometric Earrings,1.79
"Stripe Splicing Button Decor Hoodie, Casual Long Sleeve Hoodie, Women's Clothing",12.59
3pcs/Set Universal Car Seat Cover Flax Seat Protect Cushion Automobile Cushion Protector Pad Car Covers Mat Protect Front Rear Linen Fabric Cushion,26.97
26 Pcs Nail Clippers Manicure Set Stainless Steel Nail Cutter Scissor Cuticle Nipper Nail Tools Set,4.47
"1PC Black Tourmaline Rose Quartz Lepidolite White Howlite Hematite Round Bead Bracelet For Stress Reduction, Crystal Gift",2.69
"Colorblock Stripe Print Crew Neck T-Shirt, Casual Long Sleeve Top For Spring & Fall, Women's Clothing",8.49
"2-in-1 Auto Skin Tag Remover Kit - Painless and Effective Mole, Wart, and Stain Removal for Face and Body Care",5.97
"Waterproof Smart Watch With Sleep Tracker, Pedometer, And Multiple Sports Modes - Perfect Fitness Watch For Men And Women",13.99
1pcs Moon Star Etc Shape Pattern Pendant Loose Beads For DIY Jewelry Handmade Supplies,1.34
5ft Christmas Inflatables Snowman Outdoor Yard Decor With Rotating LED Lights Christmas Blow Up Decoration Garden,31.98
"18 Colors Eyeliner Gel Pen, Smudge Proof, Sweat Proof, Long Lasting , Easy Outline Eyeliner Lip Liner Pen",2.48
"Halloween Elements Cartoon Pattern Men's Summer Short Sleeve Lapel Shirt, Special Gift",8.90
"Butterfly Print Pajama Set, Lettuce Trim Cami Top & Elastic Waistband Shorts, Women's Sleepwear & Loungewear",5.39
"1 Set Kitchen Vegetable Chopper, 14-in-1 Vegetable Chopper Food Cutter With 8 Stainless Steel Blades And Container Ideal For Slicing Onions Garlic",13.49
"Cute Cartoon Brooch For Boys, Gift For Boys",0.97
Smart Watch For Men With 1.32” HD Touch Screen Wireless Calling Fitness Tracker 24h Heart Rate Sleep Monitor Activity Tracker Pedometer Fitness Watch Step Counter Sports Smartwatch For IOS Android,33.98
"40 OZ Stanley Cups Travel Tumbler Accessories, Stainless Steel Reusable Straws W/Cleaning Brush & Drawstring Bag-Perfect Summer & Winter Drinkware Accessories !",2.69
"Ring Toss Games, Handheld Hook Ring Toss Board Games With Shooting Ladder, Handmade Wooden Fast-paced Interactive Games For Home Party",8.98
"1pc Halloween Gift Witch Resin Statue, For Outdoor Indoor Garden Yard Lawn Porch Balcony Patio Decor",7.38
"Grandma Letter Print Drawstring Loose Hoodie, Casual Hooded Fashion Long Sleeve Sweatshirt, Women's Clothing",13.48
1pc Alloy Beads Loose Spacer Beads DIY Bracelets Anklets Necklaces Clothing Accessories,0.89
"5/8/22pcs, Drill Brush Attachment Set, 7 Pack 1/4in Power Scrubber Brush + Extend Long Attachment, Brush Drill Attachment, Power Cleaning Scrub Brush For Bathroom, Tub, Tile, Corner, Floor",4.89
"1pc, Hematite Magnetic Bracelet, Man Weight Loss Bracelet, Natural Stone Magnetic Bracelet, Slimming Woman Health Care Therapy Jewelry, Creative Small Gift, Holiday Accessory, Birthday Party Supplies, Birthday Gift, Art Craft Ornament Gift",2.49
"Halloween Funny Spider Stud Earrings, Girls 3D Creepy Black Spider Ear Stud Earrings, Halloween Costumes Party DIY Decoration",1.48
Heart Birthstone Necklace For Women 925 Sterling Silver 18K Gold Plated Zircon Gift Valentine's Day,6.98
"Ethnic Print Drawstring Aline Dress, Vintage Off Shoulder Button Decor Dress For Spring & Fall, Women's Clothing",15.97
"Winter Snow Boots, Women's Ankle Boots, Women Boots, Non Slip Warm Plush Shoes",10.98
"Stay Warm And Protected: Polar Fleece Balaclava Hood Face Mask For Cycling, Skiing, And Training",4.27
1pc Sparkling Men's And Women's Minimalist Chain Sky Star Necklace (18-30 Inches),1.98
1pc Clear Transparent Hooded Pet Plastic Raincoat Poncho For Cats And Dogs Clothes,2.87
"2pcs, Halloween Kitchen Towels, Scouring Pad, Ghost Pumpkin Bat Pattern Dish Cloths, Fiber Fingertip Hand Towel Decorative Tea Towels, For Decorative Bathroom Guest Holiday, Halloween Decor, Kitchen Supplies",5.59
"Plus Size Casual Outfits Set, Women's Plus Solid Long Sleeve Hooded Zipper Coat & Drawstring Pants Outfits Two Piece Set",19.19
12V Super Suction Car Vacuum Cleaner - High Power Handheld Mini Vacuum For Home & Car Interior Cleaning,10.79
"Women's Cartoon Cute Cow House Slippers, Warm Plush Lined Home Slippers, Women's Cozy Indoor Shoes",7.88
200pcs 4mm Exquisite Colorful Transparent Faceted Round Glazed Loose Spacer Beads For DIY Crafting Jewelry Accessory Making Supplies,1.34
"1pc NEW 20pcs Cigarette Capacity Case Box Or USB Lighter With Cigarette Box, Flameless Removable Electronic Lighter, Windproof Torch Lighter",2.99
"Pimple Patches, Patch Hydrocolloid Face Mask Pimple Patches, Spot Stickers For Skin Care Beauty Product",2.24
"1pc Triangle Wall Mounted Shower Caddy Rack for Bathroom and Kitchen - Easy Installation, Convenient Storage, and Organization of Bathroom Accessories bathroom accessories",4.98
1pc Digital Wrist Blood Pressure Monitor with Irregular Heart Beat Detection - No Batteries Required!,9.79
Large Capacity Travel Backpack Waterproof And Lightweight Outdoor Hiking Camping Backpack,23.48
"Creative Elegant Sparkling Rhinestone Decor Knotted Design Stud Earrings, Daily Accessories, Holiday Birthday Party Jewelry, Anniversary Commemorative Gift",0.98
"Phone Holder For Car, Cell Phone Mount, For Car Dashboard Windshield Compatible For IPhone All Smartphones",6.55
40 OZ Stanley Cups Travel Tumbler Accessories - Stainless Steel Reusable Straws W/ Cleaning Brush & Drawstring Bag - Perfect Summer & Winter Drinkware Accessories!,2.79
"1pc, New Teeth Whitening Toothpaste, Take Care Of Your Mouth Fresh Breath Confident Smile, Cleansing Teeth Stains, Oral Care Products",4.99
"Plaid Button Front Shirt, Elegant Long Sleeve Lapel Shirt, Women's Clothing",10.79
"E99 Pro K3 Drone: Folding Quadcopter Drone - HD Dual Camera,Perfect Toy & Christmas Gift For Kids & Adults",19.01
"12pcs Quick Neck Pain Relieve Patch Wormwood Natural Herbs Muscle Soreness Pain Relieve Sticker For Back, Neck, Arthritis Pain Heat Patch",1.79
1pc Floor Scrub Brush Shower Scrubber Cleaning Bath Tub And Tile Scrubber Brush Long Handle Detachable Stiff Bristles For Cleaning Shower Bathroom Kitchen Balcony Wall 37.4” Length,6.29
Wolf Glass Dome Luminous Necklace Handmade Rope Chain Wooden Pendant Necklaces For Women Men Jewelry,2.08
2023 New Pro4 Tws Waterproof In-Ear Hi-fi Stereo Wireless Earbuds Sports Gaming Headset For IOS/Android Phones,3.97
"1pc Farmhouse Laundry Room Foam Rug Runner, Non Slip Laundry Rugs And Mats For Laundry Room Decor Washable Runner Rugs For Kitchen Floor Laundry Room Bathroom Hallway Entryway Area Rugs",8.98
"High Waist Straight Camouflage Cargo Jeans, Camo Print Medium Stretch Side Flap Pocket High Rise Denim Pants, Women's Denim Jeans & Clothing",12.99
1pc Epoxy Resin Loop Pendant Silicone Mold Epoxy Resin Shiny Glossy Love Ribbon Bear Paw Keychains Silicone Mold Clearance For Handmade Polymer Clay Pendant Charms Making,1.48
